as_of_date,member_id,permno,symbol,ticker_history,company_name,current_security_name,start_date,end_date,source,quote_status
1984-12-31,permno-12140-19570301,12140,GR,GR,GOODRICH CORP; GOODRICH B F CO,,1957-03-01,1996-01-02,wrds,reused_symbol_requires_override
1984-12-31,permno-25005-19570301,25005,GRA,GRA,GRACE W R & CO,,1957-03-01,1996-01-02,wrds,reused_symbol_requires_override
1984-12-31,permno-23253-19821021,23253,GRL,GRL,GENERAL INSTRUMENT CORP,,1982-10-21,1990-08-13,wrds,reused_symbol_requires_override
1984-12-31,permno-16424-19601026,16424,GS,"G, GS",GILLETTE SAFETY RAZOR CO; GILLETTE CO,,1960-10-26,1996-01-02,wrds,ticker_history_requires_override
1984-12-31,permno-12095-19570301,12095,GSX,"GRS, GSX",GENERAL SIGNAL CORP; GENERAL RY SIGNAL CO,,1957-03-01,1996-01-02,wrds,ticker_history_requires_override
1984-12-31,permno-16432-19570301,16432,GT,GT,GOODYEAR TIRE & RUBBER CO,,1957-03-01,1996-01-02,wrds,reused_symbol_requires_override
1984-12-31,permno-21004-19570301,21004,GTE,"GEN, GTE",G T E CORP; GENERAL TEL CORP; GENERAL TEL & ELECTRS CORP,,1957-03-01,1996-01-02,wrds,ticker_history_requires_override
1984-12-31,permno-27115-19650617,27115,GWF,GWF,GREAT WESTERN FINANCIAL CORP,,1965-06-17,1996-01-02,wrds,reused_symbol_requires_override
1984-12-31,permno-52695-19810514,52695,GWW,GWW,GRAINGER W W INC,,1981-05-14,1996-01-02,wrds,reused_symbol_requires_override
1984-12-31,permno-23915-19640220,23915,GXP,"GP, GXP",GEORGIA PACIFIC PLYWOOD CO; GEORGIA PACIFIC CORP; GEORGIA PACIFIC PLYWD & LMBR CO,,1964-02-20,1996-01-02,wrds,ticker_history_requires_override
1984-12-31,permno-40838-19810910,40838,H,"GCN, H",HARCOURT GENERAL INC; GENERAL CINEMA CORP,,1981-09-10,1996-01-02,wrds,ticker_history_requires_override
1984-12-31,permno-52978-19840913,52978,HAS,HAS,HASBRO INC; HASBRO INDUSTRIES INC; HASBRO BRADLEY INC,,1984-09-13,1996-01-02,wrds,reused_symbol_requires_override
1984-12-31,permno-27924-19680523,27924,HBJ,"HBW, HBJ",HARCOURT BRACE & WORLD INC; HARCOURT BRACE JOVANOVICH INC,,1968-05-23,1991-11-22,wrds,ticker_history_requires_override
1984-12-31,permno-39765-19730301,39765,HDL,HDL,HANDLEMAN CO,,1973-03-01,1996-01-02,wrds,auto
1984-12-31,permno-28484-19840517,28484,HES,"AHC, HES",HESS OIL & CHEM CORP; AMERADA HESS CORP; HESS CORP,,1984-05-17,1996-01-02,wrds,ticker_history_requires_override
1984-12-31,permno-20124-19570301,20124,HFC,"HI, HFC",HOUSEHOLD FINANCE CORP; HOUSEHOLD INTERNATIONAL INC,,1957-03-01,1996-01-02,wrds,ticker_history_requires_override
1984-12-31,permno-25582-19800626,25582,HI,"HRS, LHX, HI",L3HARRIS TECHNOLOGIES INC; HARRIS CORP; HARRIS SEYBOLD CO; HARRIS INTERTYPE CORP,,1980-06-26,1996-01-02,wrds,ticker_history_requires_override
1984-12-31,permno-39669-19700423,39669,HIA,HIA,HOLIDAY INNS INC; HOLIDAY INNS AMER INC; HOLIDAY CORP,,1970-04-23,1990-02-07,wrds,auto
1984-12-31,permno-23309-19700423,23309,HLT,HLT,HILTON HOTELS CORP,,1970-04-23,1996-01-02,wrds,reused_symbol_requires_override
1984-12-31,permno-12319-19570301,12319,HM,HM,HOMESTAKE MINING CO,,1957-03-01,1996-01-02,wrds,reused_symbol_requires_override
1984-12-31,permno-46703-19700625,46703,HMT,"MHS, HST, HMT",MARRIOTT CORP; HOST HOTELS & RESORTS INC; HOST MARRIOTT CORP; HOST MARRIOTT CORP NEW,,1970-06-25,1993-10-11,wrds,ticker_history_requires_override
1984-12-31,permno-22250-19790503,22250,HMX,"HSM, HMX",HART SCHAFFNER & MARX; HARTMARX CORP,,1979-05-03,1995-05-26,wrds,ticker_history_requires_override
1984-12-31,permno-46391-19831020,46391,HNG,HNG,HOUSTON NATURAL GAS CORP,,1983-10-20,1985-07-24,wrds,reused_symbol_requires_override
1984-12-31,permno-23077-19570301,23077,HNZ,HNZ,HEINZ H J CO,,1957-03-01,1996-01-02,wrds,reused_symbol_requires_override
1984-12-31,permno-18374-19580102,18374,HON,"MHW, HON",MINNEAPOLIS HONEYWELL REGULATOR; HONEYWELL INC,,1958-01-02,1996-01-02,wrds,ticker_history_requires_override
1984-12-31,permno-18016-19570301,18016,HPC,HPC,HERCULES POWDER CO; HERCULES INC,,1957-03-01,1996-01-02,wrds,reused_symbol_requires_override
1984-12-31,permno-15667-19570301,15667,HPT,"AHP, WYE, HPT",AMERICAN HOME PRODUCTS CORP; WYETH,,1957-03-01,1996-01-02,wrds,ticker_history_requires_override
1984-12-31,permno-35166-19750814,35166,HSL,"PBD, HSL",PEABODY GALION CORP; HERCULES GALION PRODS INC; PEABODY INTERNATIONAL CORP,,1975-08-14,1985-10-23,wrds,ticker_history_requires_override
1984-12-31,permno-51561-19790208,51561,HSP,"HCA, HSP",HOSPITAL CORP AMERICA,,1979-02-08,1989-03-15,wrds,ticker_history_requires_override
1984-12-31,permno-56485-19730531,56485,HT,HT,HUGHES TOOL CO,,1973-05-31,1987-04-08,wrds,auto
1984-12-31,permno-48653-19790208,48653,HUM,"XTC, HUM",EXTENDICARE INC; HUMANA INC,,1979-02-08,1993-03-05,wrds,ticker_history_requires_override
1984-12-31,permno-27828-19741017,27828,HWP,"HPQ, HWP",H P INC; HEWLETT PACKARD CO,,1974-10-17,1996-01-02,wrds,ticker_history_requires_override
1984-12-31,permno-12458-19570301,12458,IAD,"RT, RYI, IAD",INLAND STEEL CO; RYERSON INC; RYERSON TULL INC NEW; INLAND STEEL INDUSTRIES INC,,1957-03-01,1996-01-02,wrds,ticker_history_requires_override
1984-12-31,permno-38973-19630325,38973,ICX,"PAS, WH, IL, ICX",WHITMAN CORP; PEPSIAMERICAS INC NEW; ILLINOIS CENT INDUSTRIES INC; WHITMAN CORP NEW; I C INDUSTRIES INC,,1963-03-25,1996-01-02,wrds,ticker_history_requires_override
1984-12-31,permno-26286-19760923,26286,IDL,IDL,IDEAL BASIC INDUSTRIES INC; IDEAL CEMENT CO,,1976-09-23,1989-08-02,wrds,auto
1984-12-31,permno-56805-19760701,56805,IFC,"FIB, FIBN, IFC",INTERFIRST CORP; FIRST INTL BANCSHARES INC,,1976-07-01,1987-04-22,wrds,ticker_history_requires_override
1984-12-31,permno-40272-19760304,40272,IFF,IFF,INTERNATIONAL FLAVORS & FRAG INC,,1976-03-04,1996-01-02,wrds,reused_symbol_requires_override
1984-12-31,permno-12511-19750206,12511,IGL,"MKG, IMA, IGL",INTERNATIONAL MINERALS & CHEM CO; IMCERA GROUP INC; INTERNATIONAL AGRIC CORP; MALLINCKRODT INC NEW; MALLINCKRODT GROUP INC,,1975-02-06,1996-01-02,wrds,ticker_history_requires_override
1984-12-31,permno-15747-19720120,15747,IK,IK,INTERLAKE CORP; BY PRODUCTS COKE CORP; INTERLAKE STL CORP; INTERLAKE IRON CORP; INTERLAKE INC,,1972-01-20,1993-07-12,wrds,auto
1984-12-31,permno-44792-19841108,44792,INGR,INGR,INTERGRAPH CORP,,1984-11-08,1996-01-02,wrds,reused_symbol_requires_override
1984-12-31,permno-59328-19761209,59328,INTC,INTC,INTEL CORP,,1976-12-09,1996-01-02,wrds,reused_symbol_requires_override
1984-12-31,permno-18278-19570301,18278,ISS,ISS,INTERNATIONAL SHOE CO; INTERCO INC,,1957-03-01,1990-12-04,wrds,auto
1984-12-31,permno-12570-19570301,12570,ITT,"IIN, IT, ITT",I T T INDUSTRIES INC IND; INTERNATIONAL TEL & TELEG CORP; I T T CORP; I T T INC,,1957-03-01,1996-01-02,wrds,ticker_history_requires_override
1984-12-31,permno-18403-19570301,18403,JCP,JCP,PENNEY J C CO INC; PENNEY J C INC,,1957-03-01,1996-01-02,wrds,reused_symbol_requires_override
1984-12-31,permno-22111-19730531,22111,JNJ,JNJ,JOHNSON & JOHNSON,,1973-05-31,1996-01-02,wrds,reused_symbol_requires_override
1984-12-31,permno-21557-19570301,21557,JOY,JOY,JOY MANUFACTURING CO,,1957-03-01,1987-06-24,wrds,reused_symbol_requires_override
1984-12-31,permno-48485-19760701,48485,JP,JP,JEFFERSON PILOT CORP,,1976-07-01,1996-01-02,wrds,reused_symbol_requires_override
1984-12-31,permno-48071-19760701,48071,JPM,JPM,MORGAN J P & CO INC,,1976-07-01,1996-01-02,wrds,reused_symbol_requires_override
1984-12-31,permno-40301-19640903,40301,JWC,JWC,WALTER JIM CORP,,1964-09-03,1987-12-30,wrds,auto
1984-12-31,permno-26825-19610426,26825,K,K,KELLOGG CO,,1961-04-26,1996-01-02,wrds,reused_symbol_requires_override
1984-12-31,permno-49905-19841025,49905,KATE,"LIZ, LIZC, FNP, KATE",LIZ CLAIBORNE INC; FIFTH & PACIFIC COMPANIES INC; KATE SPADE & CO,,1984-10-25,1996-01-02,wrds,ticker_history_requires_override
1984-12-31,permno-33312-19700423,33312,KB,"SAI, BRO, KB",BROAD INC; SUNAMERICA INC; KAUFMAN & BROAD BLDG CO; KAUFMAN & BROAD INC,,1970-04-23,1989-03-07,wrds,ticker_history_requires_override
1984-12-31,permno-28433-19811210,28433,KCG,"PNC, KCC, KCG",PERMANENTE CEMENT CO; KAISER CEMENT CORP; KAISER CEMENT & GYPSUM CORP,,1981-12-10,1987-03-04,wrds,ticker_history_requires_override
1984-12-31,permno-27749-19820812,27749,KEAR,"CTCO, KEAR",KEARNEY & TRECKER CORP; CROSS & TRECKER CORP,,1982-08-12,1991-10-31,wrds,ticker_history_requires_override
1984-12-31,permno-24635-19570301,24635,KLU,KLU,KAISER ALUMINUM & CHEMICAL CORP; KAISERTECH LTD DE,,1957-03-01,1988-11-02,wrds,auto
1984-12-31,permno-12749-19570301,12749,KM,"KG, KM",K MART CORP; KRESGE S S CO,,1957-03-01,1996-01-02,wrds,ticker_history_requires_override
1984-12-31,permno-25769-19841004,25769,KMG,KMG,KERR MCGEE OIL INDUSTRIES INC; KERR MCGEE CORP,,1984-10-04,1996-01-02,wrds,reused_symbol_requires_override
1984-12-31,permno-48960-19751211,48960,KNI,"KRI, KRN, KNI",KNIGHT RIDDER NEWSPAPERS INC; KNIGHT NEWSPAPERS INC; KNIGHT RIDDER INC,,1975-12-11,1996-01-02,wrds,ticker_history_requires_override
1984-12-31,permno-38551-19751016,38551,KNS,"WCI, KSR, KNS",WARNER COMMUNICATIONS INC; KINNEY SERVICE CORP; KINNEY SERVICES INC; KINNEY NATIONAL SERVICE INC,,1975-10-16,1989-08-02,wrds,ticker_history_requires_override
1984-12-31,permno-12888-19570301,12888,LCE,LCE,INTERNATIONAL CEMENT CORP; LONE STAR CEMENT CORP; LONE STAR INDUSTRIES INC,,1957-03-01,1990-12-11,wrds,auto
1984-12-31,permno-64282-19830915,64282,LIMT,"LTD, BBWI, LB, LIMT",LIMITED STORES INC; BATH & BODY WORKS INC; L BRANDS INC; LIMITED INC; LIMITED BRANDS INC,,1983-09-15,1996-01-02,wrds,ticker_history_requires_override
1984-12-31,permno-26294-19781005,26294,LIT,LIT,LITTON INDUSTRIES INC,,1978-10-05,1994-03-17,wrds,reused_symbol_requires_override
1984-12-31,permno-40053-19760115,40053,LKS,LKS,LUCKY STORES INC,,1976-01-15,1988-06-08,wrds,auto
1984-12-31,permno-33814-19690109,33814,LLX,LLX,LOUISIANA LAND & EXPLORATION CO,,1969-01-09,1996-01-02,wrds,reused_symbol_requires_override
1984-12-31,permno-50876-19701119,50876,LLY,LLY,LILLY ELI & CO,,1970-11-19,1996-01-02,wrds,reused_symbol_requires_override
1984-12-31,permno-21178-19840719,21178,LMT,"LK, LMT",LOCKHEED CORP; LOCKHEED AIRCRAFT CORP; LOCKHEED MARTIN CORP,,1984-07-19,1996-01-02,wrds,ticker_history_requires_override
1984-12-31,permno-49015-19760701,49015,LNC,LNC,LINCOLN NATIONAL CORP,,1976-07-01,1996-01-02,wrds,reused_symbol_requires_override
1984-12-31,permno-61399-19840301,61399,LOWE,"LOW, LOWE",LOWES COMPANIES INC,,1984-03-01,1996-01-02,wrds,ticker_history_requires_override
1984-12-31,permno-56223-19741017,56223,LPX,LPX,LOUISIANA PACIFIC CORP,,1974-10-17,1996-01-02,wrds,reused_symbol_requires_override
1984-12-31,permno-25056-19570301,25056,LSG,"ENS, LSG",LONE STAR GAS CO; ENSERCH CORP,,1957-03-01,1996-01-02,wrds,ticker_history_requires_override
1984-12-31,permno-22728-19570301,22728,LST,LST,LOWENSTEIN M & SONS; LOWENSTEIN M & SONS INC; LOWENSTEIN M CORP,,1957-03-01,1985-11-13,wrds,auto
1984-12-31,permno-43318-19820909,43318,LTC,LTC,LEASEWAY TRANSPORTATION CORP,,1982-09-09,1987-07-08,wrds,auto
1984-12-31,permno-25507-19840719,25507,LTV,LTV,LING TEMCO VOUGHT INC; L T V CORP; TEMCO AIRCRAFT CORP; LING TEMCO ELECTRS INC,,1984-07-19,1986-07-23,wrds,auto
1984-12-31,permno-52564-19790503,52564,LVI,LVI,LEVI STRAUSS & CO,,1979-05-03,1985-09-04,wrds,auto
1984-12-31,permno-13100-19570301,13100,MA,"MAY, MA",MAY DEPARTMENT STORES CO,,1957-03-01,1996-01-02,wrds,ticker_history_requires_override
1984-12-31,permno-26729-19651014,26729,MAC,"MD, MAC",MCDONNELL CO; MCDONNELL DOUGLAS CORP; MCDONNELL AIRCRAFT CORP,,1965-10-14,1996-01-02,wrds,ticker_history_requires_override
1984-12-31,permno-34147-19801120,34147,MAI,MAI,MICROWAVE ASSOCIATION INC; M A COM INC,,1980-11-20,1995-06-30,wrds,auto
1984-12-31,permno-34032-19810618,34032,MAS,MAS,MASCO CORP,,1981-06-18,1996-01-02,wrds,reused_symbol_requires_override
1984-12-31,permno-39538-19820311,39538,MAT,MAT,MATTEL INC,,1982-03-11,1996-01-02,wrds,reused_symbol_requires_override
1984-12-31,permno-27086-19670713,27086,MCA,MCA,M C A INC,,1967-07-13,1990-12-28,wrds,auto
1984-12-31,permno-43449-19700625,43449,MCD,MCD,MCDONALDS CORP,,1970-06-25,1996-01-02,wrds,reused_symbol_requires_override
1984-12-31,permno-50404-19820624,50404,MCIC,MCIC,M C I COMMUNICATIONS CORP,,1982-06-24,1996-01-02,wrds,reused_symbol_requires_override
1984-12-31,permno-42796-19680523,42796,MDP,MDP,MEREDITH CORP,,1968-05-23,1996-01-02,wrds,reused_symbol_requires_override
1984-12-31,permno-64629-19830103,64629,MDR,MDR,MCDERMOTT INTERNATIONAL INC,,1983-01-03,1996-01-02,wrds,reused_symbol_requires_override
1984-12-31,permno-19895-19570301,19895,MEA,MEA,MEAD CORP,,1957-03-01,1996-01-02,wrds,reused_symbol_requires_override
1984-12-31,permno-26382-19800117,26382,MEE,"FLR, MEE",MASSEY ENERGY CO; FLUOR CORP; FLUOR LTD,,1980-01-17,1996-01-02,wrds,ticker_history_requires_override
1984-12-31,permno-12933-19840301,12933,MEI,MEI,MINNESOTA ENTERPRISES INC; M E I DIVERSIFIED INC; TWIN CITY RAPID TRANSIT CO; M E I CORP,,1984-03-01,1986-06-04,wrds,auto
1984-12-31,permno-52919-19820408,52919,MER,MER,MERRILL LYNCH PIERCE FENNER; MERRILL LYNCH & CO INC,,1982-04-08,1996-01-02,wrds,reused_symbol_requires_override
1984-12-31,permno-61794-19800617,61794,MGM,MGM,M G M U A ENTERTAINMENT CO; METRO GOLDWYN MAYER FILM CO,,1980-06-17,1986-04-02,wrds,reused_symbol_requires_override
1984-12-31,permno-20263-19570301,20263,MGR,MGR,MCGRAW EDISON CO; MCGRAW ELECTRIC CO,,1957-03-01,1985-05-08,wrds,auto
1984-12-31,permno-48223-19760701,48223,MHC,MHC,MANUFACTURERS HANOVER CORP,,1976-07-01,1991-12-31,wrds,auto
1984-12-31,permno-20562-19570301,20562,ML,ML,MARTIN GLENN L CO; MARTIN MARIETTA CORP; MARTIN CO; MARTIN MARIETTA CORP NEW,,1957-03-01,1995-03-15,wrds,auto
1984-12-31,permno-27027-19601214,27027,MLL,"CRW, MLL",MACMILLAN INC; CROWELL COLLIER & MACMILLAN INC; CROWELL COLLIER PUBG CO,,1960-12-14,1988-11-09,wrds,ticker_history_requires_override
1984-12-31,permno-22023-19570301,22023,MMO,"GWO, MMO",MONARCH MACHINE TOOL CO; GENESIS WORLDWIDE INC,,1957-03-01,1992-07-02,wrds,ticker_history_requires_override
1984-12-31,permno-59379-19760701,59379,MNBT,"MEL, MNBT",MELLON BANK CORP; MELLON NATIONAL CORP; MELLON FINANCIAL CORP,,1976-07-01,1996-01-02,wrds,ticker_history_requires_override
1984-12-31,permno-22760-19570301,22760,MOH,MOH,MOHASCO CORP; SMITH ALEXANDER & SONS CARPET CO; MOHASCO INDUSTRIES INC; SMITH ALEXANDER INC,,1957-03-01,1988-07-13,wrds,reused_symbol_requires_override
1984-12-31,permno-45065-19780413,45065,MSA,MSA,MESA PETROLEUM CO,,1978-04-13,1985-12-11,wrds,auto
1984-12-31,permno-22891-19820617,22891,MST,MST,MERCANTILE STORES INC,,1982-06-17,1996-01-02,wrds,reused_symbol_requires_override
1984-12-31,permno-18382-19570301,18382,MTC,"PHA, MTC",MONSANTO CHEMICAL CO; PHARMACIA CORP; MONSANTO CO; MONSANTO CHEMICAL WORKS INC,,1957-03-01,1996-01-02,wrds,ticker_history_requires_override
1984-12-31,permno-13119-19601214,13119,MYG,MYG,MAYTAG CORP; MAYTAG CO,,1960-12-14,1996-01-02,wrds,reused_symbol_requires_override
1984-12-31,permno-22680-19570301,22680,MZ,"CMZ, MZ",CINCINNATI MILACRON INC; CINCINNATI MILLING MACHINE CO; MILACRON INC,,1957-03-01,1996-01-02,wrds,ticker_history_requires_override
1984-12-31,permno-12976-19570301,12976,MZ,MZ,MACY R H & CO INC,,1957-03-01,1986-07-16,wrds,reused_symbol_requires_override
1984-12-31,permno-12546-19570301,12546,N,N,INCO LTD; INTERNATIONAL NICKEL CO CDA LTD,,1957-03-01,1996-01-02,wrds,auto
1984-12-31,permno-16803-19570301,16803,NAC,NAC,MC KEESPORT TIN PLATE CO; MC KEESPORT TIN PLATE CORP; NATIONAL CAN CORP,,1957-03-01,1985-05-08,wrds,auto
1984-12-31,permno-12503-19570301,12503,NAV,"HR, NAV",INTERNATIONAL HARVESTER CO; NAVISTAR INTERNATIONAL CORP,,1957-03-01,1996-01-02,wrds,ticker_history_requires_override
1984-12-31,permno-63255-19810706,63255,NB,NB,NABISCO BRANDS INC,,1981-07-06,1985-09-11,wrds,auto
1984-12-31,permno-28118-19620425,28118,NC,"NCO, NC",NACCO INDUSTRIES INC; NORTH AMERICAN COAL CORP,,1962-04-25,1996-01-02,wrds,ticker_history_requires_override
1984-12-31,permno-19537-19570301,19537,NC,"NCR, NC",NATIONAL CASH REGISTER CO; N C R CORP,,1957-03-01,1991-09-19,wrds,ticker_history_requires_override
1984-12-31,permno-24205-19760701,24205,NEE,"FPL, NEE",FLORIDA POWER & LIGHT CO; NEXTERA ENERGY INC; F P L GROUP INC,,1976-07-01,1996-01-02,wrds,ticker_history_requires_override
1984-12-31,permno-21207-19690515,21207,NEM,NEM,NEWMONT GOLDCORP CORP; NEWMONT CORP; NEWMONT MINING CORP,,1969-05-15,1996-01-02,wrds,reused_symbol_requires_override
1984-12-31,permno-20570-19570301,20570,NG,NG,NATIONAL GYPSUM CO,,1957-03-01,1986-05-07,wrds,auto
1984-12-31,permno-17278-19830913,17278,NII,"FOX, AAV, NII",AVATEX CORP; FOXMEYER HEALTH CORP; NATIONAL INTERGROUP INC,,1983-09-13,1994-09-26,wrds,ticker_history_requires_override
1984-12-31,permno-13303-19570301,13303,NL,"LT, NL",N L INDUSTRIES INC; NATIONAL LEAD CO,,1957-03-01,1994-01-03,wrds,ticker_history_requires_override
1984-12-31,permno-24184-19570301,24184,NMK,NMK,NIAGARA MOHAWK POWER CORP; NIAGARA MOHAWK HOLDINGS INC,,1957-03-01,1996-01-02,wrds,reused_symbol_requires_override
1984-12-31,permno-38703-19760701,38703,NOB,"WFC, NOB",WELLS FARGO & CO NEW; NORTHWEST BANCORPORATION; NORWEST CORP,,1976-07-01,1996-01-02,wrds,ticker_history_requires_override
1984-12-31,permno-58596-19840809,58596,NOXL,NOXL,NOXELL CORP,,1984-08-09,1989-11-30,wrds,auto
1984-12-31,permno-18948-19570301,18948,NR,"ROK, NV, NR",ROCKWELL INTERNATIONAL CORP; NORTH AMERICAN ROCKWELL CORP; NORTH AMERICAN AVIATION INC,,1957-03-01,1996-01-02,wrds,ticker_history_requires_override
1984-12-31,permno-64311-19820603,64311,NSC,NSC,NORFOLK SOUTHERN CORP,,1982-06-03,1996-01-02,wrds,reused_symbol_requires_override
1984-12-31,permno-51377-19761209,51377,NSM,NSM,NATIONAL SEMICONDUCTOR CORP,,1976-12-09,1996-01-02,wrds,reused_symbol_requires_override
1984-12-31,permno-58640-19801120,58640,NT,"NE, NT",NORTEL NETWORKS CORP NEW; NORTHERN TELECOM LTD; NORTHERN ELECTRIC LTD; NORTEL NETWORKS CORP,,1980-11-20,1996-01-02,wrds,ticker_history_requires_override
1984-12-31,permno-21485-19760115,21485,NWA,NWA,N W A INC; NORTHWEST AIRLINES INC,,1976-01-15,1989-07-26,wrds,auto
1984-12-31,permno-21995-19781124,21995,NWT,"NW, NWT",NORTHWEST INDUSTRIES INC; CHICAGO & NORTH WESTERN RY CO,,1978-11-24,1985-07-31,wrds,ticker_history_requires_override
1984-12-31,permno-47466-19841123,47466,NYK,"NYT, NYK",NEW YORK TIMES CO,,1984-11-23,1996-01-02,wrds,ticker_history_requires_override
1984-12-31,permno-66018-19831201,66018,NYN,NYN,NYNEX CORP,,1983-12-01,1996-01-02,wrds,reused_symbol_requires_override
1984-12-31,permno-24539-19570301,24539,OAT,OAT,QUAKER OATS CO,,1957-03-01,1996-01-02,wrds,reused_symbol_requires_override
1984-12-31,permno-13661-19570301,13661,OI,OI,OWENS ILLINOIS INC; OWENS ILLINOIS GLASS CO; OWENS BOTTLE CO,,1957-03-01,1987-03-25,wrds,reused_symbol_requires_override
1984-12-31,permno-20394-19730301,20394,OM,OM,OUTBOARD MARINE CORP; OUTBOARD MARINE & MFG CO,,1973-03-01,1996-01-02,wrds,reused_symbol_requires_override
1984-12-31,permno-42024-19700423,42024,OMX,"BCC, OMX",BOISE CASCADE CORP; OFFICEMAX INC NEW,,1970-04-23,1996-01-02,wrds,ticker_history_requires_override
1984-12-31,permno-25232-19570301,25232,ONG,"OKE, ONG",ONEOK INC; OKLAHOMA NAT GAS CO; ONEOK INC NEW,,1957-03-01,1996-01-02,wrds,ticker_history_requires_override
1984-12-31,permno-39394-19820603,39394,OVT,OVT,OVERNITE TRANSPORTATION CO,,1982-06-03,1986-12-17,wrds,auto
1984-12-31,permno-24811-19570301,24811,OWC,"OCF, OWC",OWENS CORNING; OWENS CORNING FIBERGLAS CORP,,1957-03-01,1996-01-02,wrds,ticker_history_requires_override
1984-12-31,permno-34833-19821209,34833,OXY,OXY,OCCIDENTAL PETROLEUM CORP,,1982-12-09,1996-01-02,wrds,reused_symbol_requires_override
1984-12-31,permno-10241-19570301,10241,PA,"AC, PA",AMERICAN CAN CO; PRIMERICA CORP,,1957-03-01,1988-12-21,wrds,ticker_history_requires_override
1984-12-31,permno-59416-19760701,59416,PABT,PABT,PABST BREWING CO,,1976-07-01,1985-05-15,wrds,auto
1984-12-31,permno-66026-19831201,66026,PAC,PAC,PACIFIC TELESIS GROUP,,1983-12-01,1996-01-02,wrds,reused_symbol_requires_override
1984-12-31,permno-24459-19570301,24459,PBI,PBI,PITNEY BOWES INC,,1957-03-01,1996-01-02,wrds,reused_symbol_requires_override
1984-12-31,permno-60506-19801002,60506,PCAR,PCAR,PACCAR INC,,1980-10-02,1996-01-02,wrds,reused_symbol_requires_override
1984-12-31,permno-13688-19570301,13688,PCG,PCG,PACIFIC GAS & ELEC CO; P G & E CORP,,1957-03-01,1996-01-02,wrds,reused_symbol_requires_override
1984-12-31,permno-49744-19700423,49744,PCH,"PFI, PCH",POTLATCHDELTIC CORP; POTLATCH FORESTS INC; POTLATCH CORP NEW; POTLATCH CORP,,1970-04-23,1996-01-02,wrds,ticker_history_requires_override
1984-12-31,permno-32475-19781214,32475,PCI,"GW, GFW, PCI",GULF & WESTERN INC; GULF & WESTERN INDS INC; PARAMOUNT COMMUNICATIONS INC,,1978-12-14,1993-11-22,wrds,ticker_history_requires_override
1984-12-31,permno-18649-19570703,18649,PCO,"PZS, PZB, BCO, PCO",BRINKS CO; PITTSTON CO,,1957-07-03,1996-01-02,wrds,ticker_history_requires_override
1984-12-31,permno-17806-19570301,17806,PD,PD,PHELPS DODGE CORP,,1957-03-01,1996-01-02,wrds,reused_symbol_requires_override
1984-12-31,permno-22082-19570301,22082,PEL,PEL,PANHANDLE EASTERN PIPE LINE CO; PANENERGY CORP; PANHANDLE EASTERN CORP,,1957-03-01,1996-01-02,wrds,reused_symbol_requires_override
1984-12-31,permno-13821-19570301,13821,PGL,PGL,PEOPLES ENERGY CORP; PEOPLES GAS CO; PEOPLES GAS LT & COKE CO,,1957-03-01,1996-01-02,wrds,reused_symbol_requires_override
1984-12-31,permno-54148-19840412,54148,PHM,PHM,PULTE HOME CORP; PULTE CORP; PULTE GROUP INC; PULTE HOMES INC; P H M CORP,,1984-04-12,1996-01-02,wrds,reused_symbol_requires_override
1984-12-31,permno-24192-19760701,24192,PIN,PIN,PUBLIC SVC CO IND INC; P S I RESOURCES INC; P S I HOLDINGS INC,,1976-07-01,1994-10-24,wrds,auto
1984-12-31,permno-16870-19570301,16870,PLT,"PET, PLT",PACIFIC LTG CORP; PACIFIC ENTERPRISES,,1957-03-01,1996-01-02,wrds,ticker_history_requires_override
1984-12-31,permno-21397-19700423,21397,PLY,"CHA, UPC, PLY",CHAMPION INTERNATIONAL CORP; UNITED STATES PLYWOOD CORP; UNITED STATES PLYWOOD CHAMPION,,1970-04-23,1996-01-02,wrds,ticker_history_requires_override
1984-12-31,permno-20984-19570301,20984,PN,PN,PAN AMERN WORLD AWYS INC; PAN AMERN AWYS CORP; PAN AM CORP,,1957-03-01,1991-01-09,wrds,auto
1984-12-31,permno-26438-19640130,26438,PRD,PRD,POLAROID CORP,,1964-01-30,1996-01-02,wrds,reused_symbol_requires_override
1984-12-31,permno-60337-19841227,60337,PRME,"PRM, PRME",PRIME COMPUTER INC,,1984-12-27,1989-08-23,wrds,ticker_history_requires_override
1984-12-31,permno-16360-19770519,16360,PSY,PSY,PILLSBURY CO; PILLSBURY FLOUR MILLS CO; PILLSBURY FLOUR MILLS INC; PILLSBURY COMPANY; PILLSBURY MILLS INC,,1977-05-19,1989-01-04,wrds,auto
1984-12-31,permno-35211-19830310,35211,PZL,"SP, PZE, PZL",SOUTH PENN OIL CO; PENNZOIL CO; PENNZENERGY CO; PENNZOIL UNITED INC,,1983-03-10,1996-01-02,wrds,ticker_history_requires_override
1984-12-31,permno-27633-19821230,27633,R,"RDR, R",RYDER SYSTEMS INC,,1982-12-30,1996-01-02,wrds,ticker_history_requires_override
1984-12-31,permno-14912-19570301,14912,R,R,UNIROYAL INC; UNITED STATES RUBBER CO,,1957-03-01,1985-09-25,wrds,reused_symbol_requires_override
1984-12-31,permno-46922-19751211,46922,RAD,RAD,RITE AID CORP,,1975-12-11,1996-01-02,wrds,reused_symbol_requires_override
1984-12-31,permno-28353-19631205,28353,RAL,RAL,RALSTON PURINA CO,,1963-12-05,1996-01-02,wrds,reused_symbol_requires_override
1984-12-31,permno-45014-19711209,45014,RAM,RAM,RAMADA INNS INC,,1971-12-09,1989-12-20,wrds,auto
1984-12-31,permno-14090-19570301,14090,RCA,RCA,RADIO CORP AMER; R C A CORP,,1957-03-01,1986-06-11,wrds,auto
1984-12-31,permno-25267-19570301,25267,RD,RD,ROYAL DUTCH PETROLEUM CO,,1957-03-01,1996-01-02,wrds,auto
1984-12-31,permno-41662-19751211,41662,RDS,RDS,REVCO D S INC,,1975-12-11,1986-12-17,wrds,auto
1984-12-31,permno-41486-19740509,41486,RE,RE,REDMAN INDUSTRIES INC,,1974-05-09,1988-10-26,wrds,reused_symbol_requires_override
1984-12-31,permno-25988-19670518,25988,REV,REV,REVLON INC,,1967-05-18,1985-11-20,wrds,auto
1984-12-31,permno-14218-19570301,14218,RJR,RJR,R J R NABISCO INC; REYNOLDS R J INDUSTRIES INC; REYNOLDS R J TOBACCO CO,,1957-03-01,1989-02-08,wrds,auto
1984-12-31,permno-18921-19570301,18921,RLM,RLM,REYNOLDS METALS CO,,1957-03-01,1996-01-02,wrds,reused_symbol_requires_override
1984-12-31,permno-47490-19841123,47490,RML,RML,RUSSELL CORP; RUSSELL MLS INC,,1984-11-23,1996-01-02,wrds,reused_symbol_requires_override
1984-12-31,permno-59432-19760701,59432,ROAD,"CBB, ROAD",ROADWAY SERVICES INC; CALIBER SYSTEM INC; ROADWAY EXPRESS INC,,1976-07-01,1996-01-02,wrds,ticker_history_requires_override
1984-12-31,permno-23990-19820916,23990,ROH,ROH,ROHM & HAAS CO,,1982-09-16,1996-01-02,wrds,reused_symbol_requires_override
1984-12-31,permno-20343-19680718,20343,ROP,ROP,ROPER GEO D CORP MASS; ROPER CORP; ROPER GEO D CORP; FLORENCE STOVE CO,,1968-07-18,1988-04-13,wrds,reused_symbol_requires_override
1984-12-31,permno-15560-19730301,15560,RSH,"TAN, RSH",RADIOSHACK CORP; AMERICAN HIDE & LEATHER CO; TANDY CORP; GENERAL AMERICAN INDUSTRIES INC,,1973-03-01,1996-01-02,wrds,ticker_history_requires_override
1984-12-31,permno-24942-19570301,24942,RTN,RTN,RAYTHEON MANUFACTURING CO; RAYTHEON CO,,1957-03-01,1996-01-02,wrds,reused_symbol_requires_override
1984-12-31,permno-52062-19840412,52062,RYN,RYN,RYAN HOMES INC,,1984-04-12,1986-12-03,wrds,auto
1984-12-31,permno-14322-19570301,14322,S,S,SEARS ROEBUCK & CO,,1957-03-01,1996-01-02,wrds,reused_symbol_requires_override
1984-12-31,permno-17291-19570301,17291,SA,SA,SAFEWAY STORES INC,,1957-03-01,1986-11-26,wrds,auto
1984-12-31,permno-59440-19760701,59440,SAFC,"SAF, SAFC",SAFECO CORP,,1976-07-01,1996-01-02,wrds,ticker_history_requires_override
1984-12-31,permno-27596-19680118,27596,SB,"ENG, PSB, PB, SB",ENGELHARD INDUSTRIES INC; PHIBRO SALOMON INC; SALOMON INC; PHIBRO CORP; ENGELHARD MINERALS & CHEMS CORP,,1968-01-18,1996-01-02,wrds,ticker_history_requires_override
